{
  "$schema": "./role-permission-matrix.schema.json",
  "catalogType": "canonical-rbac-role-permission-matrix",
  "version": "2.0.0",
  "rolesVersion": "2.0.0",
  "permissionsVersion": "2.0.0",
  "denyByDefault": true,
  "assignmentModel": "user-to-multiple-roles-only",
  "protectedCanonicalRoles": true,
  "grants": {
    "system-administrator": {
      "allPermissions": true, "standard": {}, "workflow": [],
      "scopeRules": ["same-tenant", "cannot-approve-own-privilege-escalation", "secret-values-never-readable", "canonical-roles-protected", "custom-roles-supported"]
    },
    "operations-manager": {
      "standard": { "equipment": ["read"], "assignment": ["read", "approve", "close"], "rental": ["read", "approve", "close"], "deur": ["read", "approve", "close"], "maintenance": ["read"], "dailyLog": ["read"], "customer": ["read"], "project": ["read"], "operator": ["read"], "reports": ["read"] },
      "workflow": ["dashboard.read", "assignment.complete", "assignment.reopen", "rental.release", "rental.return", "rental.approval.decide", "deur.acknowledge", "deur.reject", "deur.reopen", "deur.correct", "deur.customerReview.issue", "deur.managerReview.issue"],
      "scopeRules": ["same-tenant", "approval-actor-separation", "no-billing-authority"]
    },
    "dispatcher": {
      "standard": { "equipment": ["read"], "assignment": ["read", "create", "update"], "rental": ["read", "create", "update"], "deur": ["read"], "customer": ["read", "create", "update"], "project": ["read", "create", "update"], "operator": ["read", "update"], "reports": ["read"] },
      "workflow": ["dashboard.read", "assignment.operator.replace", "assignment.equipment.replace", "rental.customerContact.update", "rental.approval.submit"],
      "scopeRules": ["same-tenant", "no-operational-approval", "no-billing-authority"]
    },
    "equipment-coordinator": {
      "standard": { "equipment": ["read", "create", "update"], "assignment": ["read", "create", "update"], "rental": ["read"], "deur": ["read"], "maintenance": ["read"], "customer": ["read"], "project": ["read"], "operator": ["read"], "reports": ["read"], "masterData": ["read"] },
      "workflow": ["dashboard.read", "equipment.restore", "equipment.status.update", "equipment.assignment.coordinate", "assignment.equipment.replace"],
      "scopeRules": ["same-tenant", "no-operational-approval", "no-billing-authority"]
    },
    "operator": {
      "standard": { "assignment": ["read"], "equipment": ["read"], "deur": ["read", "create", "update"] },
      "workflow": ["deur.submit", "deur.activity.start", "deur.activity.stop", "deur.evidence.update"],
      "scopeRules": ["same-tenant", "requires-active-canonical-operator-link", "own-assignments-only", "own-equipment-only", "own-shift-only", "own-deur-history-only", "no-other-operators", "no-rental-assignment-equipment-maintenance-billing-dashboard-or-administration-authority"]
    },
    "billing-staff": {
      "standard": { "rental": ["read"], "deur": ["read"], "billing": ["read", "create", "update"], "collections": ["read", "create", "update"], "customer": ["read"], "project": ["read"], "operator": ["read"], "reports": ["read", "export"] },
      "workflow": ["dashboard.financial.read", "rental.commercialTerms.read", "billing.invoice.export", "collections.reconcile"],
      "scopeRules": ["same-tenant", "financial-reports-only", "no-operational-approval", "no-billing-approval-close-delete-finalize-reopen-issue-void-or-reversal"]
    },
    "management-viewer": {
      "standard": { "equipment": ["read"], "assignment": ["read"], "rental": ["read"], "deur": ["read"], "billing": ["read"], "collections": ["read"], "maintenance": ["read"], "dailyLog": ["read"], "customer": ["read"], "project": ["read"], "operator": ["read"], "reports": ["read", "export"] },
      "workflow": ["dashboard.executive.read", "dashboard.financial.read", "dashboard.export"],
      "scopeRules": ["same-tenant", "read-and-approved-report-export-only", "no-transaction-authority", "redacted-exports-only"]
    },
    "maintenance-staff": {
      "standard": { "equipment": ["read", "update"], "assignment": ["read"], "maintenance": ["read", "create", "update", "close"], "dailyLog": ["read", "create", "update"], "operator": ["read"], "reports": ["read"] },
      "workflow": ["equipment.maintenanceState.update", "maintenance.schedule", "maintenance.start", "maintenance.complete", "maintenance.cancel"],
      "scopeRules": ["same-tenant", "no-rental-assignment-customer-operator-project-or-billing-management"]
    },
    "read-only-auditor": {
      "standard": { "equipment": ["read"], "assignment": ["read"], "rental": ["read"], "deur": ["read"], "billing": ["read"], "collections": ["read"], "maintenance": ["read"], "dailyLog": ["read"], "customer": ["read"], "project": ["read"], "operator": ["read"], "reports": ["read", "export"], "users": ["read"], "settings": ["read"] },
      "workflow": ["dashboard.executive.read", "dashboard.financial.read", "dashboard.export", "roles.read", "roles.compare", "roles.assignedUsers.read", "permissions.catalog.read", "users.auditHistory.read", "users.effectivePermissions.read"],
      "scopeRules": ["same-tenant", "audit-visibility-only", "no-transaction-authority", "redacted-exports-only", "no-secret-token-credential-provider-body-or-encryption-material"]
    }
  }
}
